{"run_id": "0b9f1c2e-3d4a-4b5c-8d6e-7f8091a2b3c4", "model": "marts.summary", "trigger": "manual", "materialized": "table", "project_commit": null, "project_dirty": null, "versions": {"duckdb": "2.0.0", "modules": [{"name": "orvex-store", "version": "0.2.0"}]}, "since": null, "rows_read": null, "rows_written": null, "watermark": null, "tests": [], "reconciliation": [], "snapshot_id": null, "started_at": "2026-10-27T21:10:00.123456-04:00", "finished_at": "2026-10-27T21:10:02.5-04:00", "outcome": "not_run", "error": null}
